{
  "schemaVersion": "creator-kit-source-lock.v1",
  "exporterVersion": "creator-kit-exporter/1.5.0",
  "repository": "Spectoda/documentation",
  "commit": "67827bf5d2680de8bbb7a3a7e73773441669cbf3",
  "files": [
    {
      "sourcePath": "en/pro-vyrobce-a-tvurce/controller-config/ethernet.md",
      "sourceSha256": "1ada69f668140b497925ca13f7000f94800a967b896d6bcf17e69033a2bb4152",
      "normalizedSha256": "d6441fd0b663b8f77cf9c6acee73dd4d475cbcb1abf1f56118f67ff5294b1e1b",
      "license": "CC-BY-4.0",
      "publicDerivative": true,
      "legalTraceabilityStatus": null,
      "legalTraceability": null
    },
    {
      "sourcePath": "en/pro-vyrobce-a-tvurce/controller-config/fw-01211-io-types.md",
      "sourceSha256": "2ae57764310ac4eb1d03e7ad19d7feb862580ccfc4745cd909d0a36977a0f175",
      "normalizedSha256": "be46c6310b87bcfeccea6edd9777ed4cf499487f1465982ac70b5779d9cf5824",
      "license": "CC-BY-4.0",
      "publicDerivative": true,
      "legalTraceabilityStatus": null,
      "legalTraceability": null
    },
    {
      "sourcePath": "en/pro-vyrobce-a-tvurce/controller-config/fw-01211-keywords.md",
      "sourceSha256": "f30b1802181640bfc3655e0592107041ff7d917a3f7f6db2f934cb9f6d314399",
      "normalizedSha256": "df4c7c27d4bc24e92ce7f615232be6ade609a31db207c31ee54640de89f5034e",
      "license": "CC-BY-4.0",
      "publicDerivative": true,
      "legalTraceabilityStatus": null,
      "legalTraceability": null
    },
    {
      "sourcePath": "en/pro-vyrobce-a-tvurce/controller-config/index.md",
      "sourceSha256": "e06be5e5b5ddb5788bc8bb5ce239684fe622f0106d92051a1fe8af47bf60f18e",
      "normalizedSha256": "4d732a088bfa28cd9743285d26155a34f7a60d8990785a763c99b8a77cc67d9d",
      "license": "CC-BY-4.0",
      "publicDerivative": true,
      "legalTraceabilityStatus": null,
      "legalTraceability": null
    },
    {
      "sourcePath": "en/pro-vyrobce-a-tvurce/controller-config/io-type-dali.md",
      "sourceSha256": "fe41a923e09eb0b5a7466b6a8b2226d3bdcad1357286ffc6188491905e2eddec",
      "normalizedSha256": "e29e767380b857be6295bef82fc4878f005a025b3ec9d537de427e1b06c98ec3",
      "license": "CC-BY-4.0",
      "publicDerivative": true,
      "legalTraceabilityStatus": null,
      "legalTraceability": null
    },
    {
      "sourcePath": "en/pro-vyrobce-a-tvurce/controller-config/wasm-schema.md",
      "sourceSha256": "a6a295184e54d7d8610d07d902d7a46d3242951b2be97c56bda2e4247e6240d0",
      "normalizedSha256": "dbd12189e36f6bb177efa500bdfa376b0829cbdd26369dff4c0889e2fc736ee5",
      "license": "CC-BY-4.0",
      "publicDerivative": true,
      "legalTraceabilityStatus": null,
      "legalTraceability": null
    },
    {
      "sourcePath": "en/pro-vyrobce-a-tvurce/spectoda-creator-kit.md",
      "sourceSha256": "787b4a475b6578a2416c934aca94198ee65b8e87354bf4d9133c8d82354d9aa2",
      "normalizedSha256": "6851992c84fb10663b32f55c1d85c876ba0b54fbf0a63bcc86a7fcd79ea44aca",
      "license": "CC-BY-4.0",
      "publicDerivative": true,
      "legalTraceabilityStatus": null,
      "legalTraceability": null
    }
  ],
  "assets": [
    {
      "role": "controller-config-contract",
      "sourcePath": "data/v2/public/assets/docs/controller-config/0.12.11/controller-config.contract.json",
      "bundlePath": "assets/docs/controller-config/0.12.11/controller-config.contract.json",
      "sourceSha256": "15cc88fe7cd1de9b68d75f45f3c5fa8fb305317f1e43b0173487b54af58bf112",
      "bundleSha256": "15cc88fe7cd1de9b68d75f45f3c5fa8fb305317f1e43b0173487b54af58bf112",
      "license": "CC-BY-4.0",
      "sourceLock": "dev-6455-cc-by-4.0-fw-0.12.11",
      "publicDerivative": true,
      "firmwareVersion": "0.12.11",
      "upstreamRepository": "Spectoda/firmware",
      "upstreamCommit": "51a8d6337d968b47f563bf2decb8f7404d93c27a",
      "upstreamRevisionCommit": "dc36700e77845254a3e075cb086e6db76049f9ab"
    },
    {
      "role": "controller-config-schema",
      "sourcePath": "data/v2/public/assets/docs/controller-config/0.12.11/controller-config.schema.json",
      "bundlePath": "assets/docs/controller-config/0.12.11/controller-config.schema.json",
      "sourceSha256": "e7cfe63edbf7942c138596ed36e60154b8839a7e0056fe07a516c02811afcfec",
      "bundleSha256": "e7cfe63edbf7942c138596ed36e60154b8839a7e0056fe07a516c02811afcfec",
      "license": "CC-BY-4.0",
      "sourceLock": "dev-6455-cc-by-4.0-fw-0.12.11",
      "publicDerivative": true,
      "firmwareVersion": "0.12.11",
      "upstreamRepository": "Spectoda/firmware",
      "upstreamCommit": "51a8d6337d968b47f563bf2decb8f7404d93c27a",
      "upstreamRevisionCommit": "dc36700e77845254a3e075cb086e6db76049f9ab"
    }
  ],
  "documentationBundle": {
    "repository": "Spectoda/documentation",
    "commit": "67827bf5d2680de8bbb7a3a7e73773441669cbf3",
    "exporterVersion": "creator-kit-exporter/1.5.0",
    "checksumDigest": "296e1aae0f73c007cfca46b773b030c8939b7140fe57804cc11617f937eee2fe"
  },
  "examples": [
    {
      "role": "selection",
      "sourcePath": "data/v2/examples/player-show-global-sparse-cues/creator-kit.json",
      "bundlePath": null,
      "sourceSha256": "c1ee45998e2d1169f33fecb8acc5d07d8d985467c0995107e218782c63c4a891",
      "bundleSha256": "c1ee45998e2d1169f33fecb8acc5d07d8d985467c0995107e218782c63c4a891",
      "license": "MIT",
      "source": {
        "repository": "Spectoda/examples",
        "commit": "97fd90afbc9839830b3dc7f73df36f385f66564d"
      }
    },
    {
      "role": "file",
      "sourcePath": "data/v2/examples/player-show-global-sparse-cues/README.md",
      "bundlePath": "examples/player-show-global-sparse-cues/README.md",
      "sourceSha256": "35fa413fe0f59efc4a0f5689986d981bd0f739048d8183dd88dda7f3336a4803",
      "bundleSha256": "35fa413fe0f59efc4a0f5689986d981bd0f739048d8183dd88dda7f3336a4803",
      "license": "MIT",
      "source": {
        "repository": "Spectoda/examples",
        "commit": "97fd90afbc9839830b3dc7f73df36f385f66564d"
      }
    },
    {
      "role": "file",
      "sourcePath": "data/v2/examples/player-show-global-sparse-cues/example.yaml",
      "bundlePath": "examples/player-show-global-sparse-cues/example.yaml",
      "sourceSha256": "3297ca221e2057b9e3d94d46eea55ec6971ff8587246b21a33373b43fe4650e9",
      "bundleSha256": "3297ca221e2057b9e3d94d46eea55ec6971ff8587246b21a33373b43fe4650e9",
      "license": "MIT",
      "source": {
        "repository": "Spectoda/examples",
        "commit": "97fd90afbc9839830b3dc7f73df36f385f66564d"
      }
    },
    {
      "role": "file",
      "sourcePath": "data/v2/examples/player-show-global-sparse-cues/player.be",
      "bundlePath": "examples/player-show-global-sparse-cues/player.be",
      "sourceSha256": "2d144a4e77d7fc6f4e6253fcd22cb9a6ec89bf3d7c9485269d0de42ce8ef3024",
      "bundleSha256": "2d144a4e77d7fc6f4e6253fcd22cb9a6ec89bf3d7c9485269d0de42ce8ef3024",
      "license": "MIT",
      "source": {
        "repository": "Spectoda/examples",
        "commit": "97fd90afbc9839830b3dc7f73df36f385f66564d"
      }
    }
  ]
}
